tester_code,understood_purpose_1_5,completed_task_1_5,form_clear_1_5,search_useful_1_5,status_clear_1_5,would_use_1_5,most_useful_feature,confusing_part,suggested_improvement
T01,5,5,5,5,5,5,Tutor Search,None,Keep current navigation
T02,5,4,4,5,4,5,Tutor Search Filters,Optional fields in request form,Label optional fields
T03,4,4,3,5,4,4,Tutor Profiles,Preferred date/time fields,Improve scheduling layout
T04,5,4,5,4,4,4,Request Status,Payment button,Make payment button larger
T05,5,5,4,5,5,5,Tutor Listing,None,Add review page before submission
T06,5,5,4,4,5,5,Tutor Profile Management,None,Add profile preview
T07,5,4,4,4,4,5,Request Approval,Registration workflow,Separate registration and application
T08,4,4,3,4,4,4,Tutor Dashboard,Supporting document upload,Explain accepted file types
T09,5,5,4,4,5,5,Tutor Approval,None,Show commission calculation
T10,5,4,4,4,4,4,Payment Verification,Verification workflow,Separate payout and verification
